subject_id,item_id,counterbalance,trial_num,selected_tangram_group,written_label,max_blue_sim,max_red_sim,mean_blue_sim,mean_red_sim
67f224dfcaaa213111714560,0,a,31,blue_specific,"This looks like a ghost with two arms raise and a head of a turnedsquare/diamond on top in the middle between the two raised arms. The ghost looks to be leaning to the left as if on a spooky chase. It kind of resembles a ghost chase in Scooby-Doo. There has been some who say it looks like an Italian with his arms raised, but really a ghost on a spook-chase leaning his chase to the left with his arms raised is more what it looks like.",0.3124133050441742,0.26157671213150024,0.18134840484708548,0.14465598948299885
67f224dfcaaa213111714560,0,a,32,blue_specific,"This looks like a buddhist facing to the left. His head is a turnedsquare/diamond and his arms are offered a little to the left with the arms of his robe draped/hanging from his arms, still. His backside is good posture and just straight as a ruler pretty much from his back shoulders to the ground. His toes stick out a little to the left from under his robes and are represented by a small triangle.",0.48082658648490906,0.4562087655067444,0.2020440901396796,0.2272418444044888
67f224dfcaaa213111714560,0,a,38,red_specific,This looks like a figure skater on one leg skating to the left with one leg lifted up to the right represented by a simple triangle shape. The left side of his body is janky with 2 triangle spikes to the left and a turnedsquare/diamond on top for possibly his head.,0.14150488376617432,0.3364250361919403,0.07751204387750477,0.17456317879259586
67f224dfcaaa213111714560,0,a,40,blue_specific,"This looks like Sasquatch joined the military and has one foot raised in front of the other... marching to the left. It looks like he has a pointy triangular beard. And it looks like he's carrying a flag over his back, but the pole or carrying can't be seen... it only stands to reason that that's what it looks like and is.",0.26104363799095154,0.25806084275245667,0.11774902907200158,0.1408692547120154
67f224dfcaaa213111714560,0,a,41,blue_specific,This looks like a buddhist priest facing to the left with a turnedsquare/diamond head and a straight posture from his back shoulder all the way to the ground just a straight edge on the right side. His arms are offered to the left with the robes of his arm hanging and draped. His toes show from under his robe on the ground to the left in the shape of a small triangle connected to his body.,0.6084464192390442,0.4942370355129242,0.20404429826885462,0.21764934295788407
67f224dfcaaa213111714560,0,a,44,blue_specific,This looks like a Ghost leaning to the left as if chasing someone... with both of his arms raised in the air trying to be Spooky. His head is a turnedsquare/diamond. Some might see this as an Italian with arms raised... but it really resembles a Ghost... it looks like its a Ghost in the middle of a Scooby-Doo chase scene.,0.3465541899204254,0.22897815704345703,0.19977496191859245,0.12764169462025166
67f224dfcaaa213111714560,0,a,52,blue_specific,This looks just like a Ghost leaning to the left with both his arms raised in the air as if trying to Spook those he is chasing. It looks like a classic chase scene out of Scooby-Doo.,0.2973376214504242,0.24321801960468292,0.1747008552774787,0.1406811373308301
616f727b03e888e0f8213eec,2,b,1,blue_specific,the duck with a diamond hat,0.7348556518554688,0.444212943315506,0.15701212151907384,0.1956439653877169
616f727b03e888e0f8213eec,2,b,6,blue_specific,squats,1.0,0.10511928796768188,0.2601094632409513,0.05869243899360299
616f727b03e888e0f8213eec,2,b,8,blue_specific,yoga dude,0.9790265560150146,0.22342588007450104,0.22196296975016594,0.1035959948785603
616f727b03e888e0f8213eec,2,b,13,red_specific,half of an island,0.3371097445487976,0.2248753011226654,0.1400312981568277,0.0922191720455885
616f727b03e888e0f8213eec,2,b,19,red_specific,half of an island,0.3371097445487976,0.2248753011226654,0.1400312981568277,0.0922191720455885
616f727b03e888e0f8213eec,2,b,25,red_specific,the innocent one,0.2800283432006836,1.0,0.10043615964241326,0.3290278159547597
616f727b03e888e0f8213eec,2,b,30,blue_specific,the duck with a diamond hat,0.7348556518554688,0.444212943315506,0.15701212151907384,0.1956439653877169
616f727b03e888e0f8213eec,2,b,31,red_specific,a person walking to the right as if they were a ghost,0.20246106386184692,0.36190566420555115,0.10666385979857296,0.12900123244617134
616f727b03e888e0f8213eec,2,b,37,blue_specific,the duck with a diamond hat,0.7348556518554688,0.444212943315506,0.15701212151907384,0.1956439653877169
616f727b03e888e0f8213eec,2,b,38,blue_specific,"cube body, diamond on top",0.5823639631271362,0.18978983163833618,0.2028259956277907,0.07675993000157177
616f727b03e888e0f8213eec,2,b,40,red_specific,"a person scaring someone, left",0.2401498407125473,0.32728683948516846,0.08003338612616062,0.18219732004217803
616f727b03e888e0f8213eec,2,b,46,blue_specific,squats,1.0,0.10511928796768188,0.2601094632409513,0.05869243899360299
616f727b03e888e0f8213eec,2,b,48,blue_specific,"cube body, diamond on top",0.5823639631271362,0.18978983163833618,0.2028259956277907,0.07675993000157177
616f727b03e888e0f8213eec,2,b,49,red_specific,a person walking to the right as if they were a ghost,0.20246106386184692,0.36190566420555115,0.10666385979857296,0.12900123244617134
62c35e9517e15b36b957a678,1,a,3,red_specific,"Square head facing right with hand facing up and forward, both feet on the ground",0.34532350301742554,0.2761061191558838,0.20672068372368813,0.17103515705093741
62c35e9517e15b36b957a678,1,a,4,red_specific,Diamond head kneeling facing right with no feet or hands visible.,0.43155738711357117,0.3142816126346588,0.22540892474353313,0.16607888601720333
62c35e9517e15b36b957a678,1,a,10,blue_specific,Square head yoga pose facing right with one foot in the air,0.6893616914749146,0.24566537141799927,0.2294707503169775,0.10024737496860325
62c35e9517e15b36b957a678,1,a,15,blue_specific,Diamond head squatting pose facing right with one hand facing forward,0.47676968574523926,0.27889031171798706,0.21609868854284286,0.13333760760724545
62c35e9517e15b36b957a678,1,a,18,blue_specific,Square head yoga pose facing right,0.6733610033988953,0.24228064715862274,0.21270800102502108,0.10661893826909363
62c35e9517e15b36b957a678,1,a,20,blue_specific,Diamond head kneeling doing Muslim prayer,0.3721022605895996,0.4077908396720886,0.17498561646789312,0.13422412052750587
62c35e9517e15b36b957a678,1,a,21,red_specific,Crazy hat sitting facing right looking down and sad,0.26049014925956726,0.6851511001586914,0.1134388605132699,0.22107155807316303
62c35e9517e15b36b957a678,1,a,23,blue_specific,Diamond head squatting pose facing right,0.547613799571991,0.28953802585601807,0.22173123760148883,0.1220859894528985
62c35e9517e15b36b957a678,1,a,25,blue_specific,Diamond head cubed body facing right one hand forward,0.3365291357040405,0.32371431589126587,0.21015763469040394,0.15228694188408554
62c35e9517e15b36b957a678,1,a,26,red_specific,Crazy hat sitting looking sad facing right,0.24915310740470886,0.6919731497764587,0.09865257982164621,0.21935837110504508
62c35e9517e15b36b957a678,1,a,31,blue_specific,Diamond head doing squat pose facing right,0.5646293759346008,0.2726873457431793,0.23376206774264574,0.09968282794579864
62c35e9517e15b36b957a678,1,a,40,red_specific,"Crazy hat sitting, facing right and looking sad",0.2590850591659546,0.6850936412811279,0.11571550276130438,0.22416661214083433
62c35e9517e15b36b957a678,1,a,41,blue_specific,Squat pose knees bent facing right,0.7131964564323425,0.19113066792488098,0.2338139871135354,0.07939175050705671
680e77f1b497bfe3d4df3514,1,a,2,red_specific,squats,1.0,0.10511928796768188,0.2642736486159265,0.05869243899360299
680e77f1b497bfe3d4df3514,1,a,6,blue_specific,Man kneeling and praying,0.47468048334121704,0.3807806968688965,0.12862672377377748,0.09975303965620697
680e77f1b497bfe3d4df3514,1,a,8,blue_specific,Standing person diamond head facing left,0.19058318436145782,0.4248809814453125,0.1371530327014625,0.14556632819585502
680e77f1b497bfe3d4df3514,1,a,10,red_specific,sitting figure with legs extended to the right,0.35632383823394775,0.17859752476215363,0.19911906123161316,0.11414315085858107
680e77f1b497bfe3d4df3514,1,a,19,blue_specific,cube body diamond on top,0.568824052810669,0.20454545319080353,0.17180307721719146,0.07499099825508893
680e77f1b497bfe3d4df3514,1,a,22,blue_specific,cube body diamond on top,0.568824052810669,0.20454545319080353,0.17180307721719146,0.07499099825508893
680e77f1b497bfe3d4df3514,1,a,23,blue_specific,standing person diamond head facing left,0.19058318436145782,0.4248809814453125,0.1371530327014625,0.14556632819585502
680e77f1b497bfe3d4df3514,1,a,35,red_specific,stretching,0.5585715770721436,0.17285066843032837,0.2665445450693369,0.07727918890304863
680e77f1b497bfe3d4df3514,1,a,38,red_specific,squats,1.0,0.10511928796768188,0.2642736486159265,0.05869243899360299
680e77f1b497bfe3d4df3514,1,a,44,red_specific,yoga,0.863739013671875,0.1849135309457779,0.244202789850533,0.08535561128519475
680e77f1b497bfe3d4df3514,1,a,48,red_specific,squats,1.0,0.10511928796768188,0.2642736486159265,0.05869243899360299
680e77f1b497bfe3d4df3514,1,a,50,red_specific,kneeling,0.6554437875747681,0.25395944714546204,0.2453261036425829,0.13756940909661353
59d7c0f750f88f000161eb21,0,b,4,red_specific,arms above head diamond head body a slanted rectangle,0.4506070017814636,0.41050490736961365,0.24255752749741077,0.16101007908582687
59d7c0f750f88f000161eb21,0,b,7,red_specific,facing left one leg in the air has a square dangling on right,0.5207833647727966,0.2542504668235779,0.27547874487936497,0.12580231670290232
59d7c0f750f88f000161eb21,0,b,9,blue_specific,diamond top in the middle connected to long line that ends in a triangle pointing right,0.3459906578063965,0.18705953657627106,0.1254254742525518,0.048347465228289366
59d7c0f750f88f000161eb21,0,b,15,red_specific,arms above head diamond head body a slanted rectangle,0.4506070017814636,0.41050490736961365,0.24255752749741077,0.16101007908582687
59d7c0f750f88f000161eb21,0,b,17,red_specific,diamond head arms forward pointing left looks like he's holding something feet also pointing left legs together,0.4224187731742859,0.3374389111995697,0.19777202187106013,0.14259069552645087
59d7c0f750f88f000161eb21,0,b,19,blue_specific,diamond top in the middle connected to long line that ends in a triangle pointing right,0.3459906578063965,0.18705953657627106,0.1254254742525518,0.048347465228289366
59d7c0f750f88f000161eb21,0,b,27,blue_specific,standing on one leg two triangles facing left diamond head triangle for butt,0.3560645580291748,0.20610231161117554,0.2474327883683145,0.0947718801908195
59d7c0f750f88f000161eb21,0,b,28,red_specific,facing left one leg in the air has a square dangling on right,0.5207833647727966,0.2542504668235779,0.27547874487936497,0.12580231670290232
59d7c0f750f88f000161eb21,0,b,30,blue_specific,diamond top in the middle connected to long line that ends in a triangle pointing right,0.3459906578063965,0.18705953657627106,0.1254254742525518,0.048347465228289366
59d7c0f750f88f000161eb21,0,b,36,red_specific,arms above head diamond head body a slanted rectangle,0.4506070017814636,0.41050490736961365,0.24255752749741077,0.16101007908582687
59d7c0f750f88f000161eb21,0,b,37,blue_specific,standing on one leg two triangles facing left diamond head triangle for butt,0.3560645580291748,0.20610231161117554,0.2474327883683145,0.0947718801908195
59d7c0f750f88f000161eb21,0,b,38,red_specific,facing left one leg in the air has a square dangling on right,0.5207833647727966,0.2542504668235779,0.27547874487936497,0.12580231670290232
59d7c0f750f88f000161eb21,0,b,42,red_specific,facing left one leg in the air has a square dangling on right,0.5207833647727966,0.2542504668235779,0.27547874487936497,0.12580231670290232
59d7c0f750f88f000161eb21,0,b,49,red_specific,arms above head diamond head body a slanted rectangle,0.4506070017814636,0.41050490736961365,0.24255752749741077,0.16101007908582687
59d7c0f750f88f000161eb21,0,b,52,blue_specific,standing on one leg two triangles facing left diamond head triangle for butt,0.3560645580291748,0.20610231161117554,0.2474327883683145,0.0947718801908195
5f5452df72345118f58d187b,0,a,0,blue_specific,contemplative mouse with square and triangular ear,0.6226339340209961,0.252865731716156,0.12941770628094673,0.11306608747690916
5f5452df72345118f58d187b,0,a,1,blue_specific,flying angel,0.2519978880882263,0.31671881675720215,0.16530304914340377,0.13125014305114746
5f5452df72345118f58d187b,0,a,3,red_specific,duck facing right with diamond on head,0.3465363085269928,0.7231307029724121,0.18187652109190822,0.1569799492135644
5f5452df72345118f58d187b,0,a,7,red_specific,diamond shape sitting on flat surface,0.16468843817710876,0.42383429408073425,0.08198744268156588,0.16938260837923735
5f5452df72345118f58d187b,0,a,13,blue_specific,person walking facing left with diamond backpack,0.2571960687637329,0.16804485023021698,0.06286972924135625,0.0805378439836204
5f5452df72345118f58d187b,0,a,14,red_specific,person facing left standing on one leg,0.146795853972435,0.5200965404510498,0.08196544158272445,0.21064059948548675
5f5452df72345118f58d187b,0,a,22,red_specific,person kneeling facing right,0.22232504189014435,0.7170445919036865,0.10014288069214672,0.27152137889061123
5f5452df72345118f58d187b,0,a,23,red_specific,duck facing right with diamond on its head,0.33263564109802246,0.7074822187423706,0.17589471372775733,0.14640292478725314
5f5452df72345118f58d187b,0,a,26,red_specific,"person on one leg facing left, both arms visible",0.23413266241550446,0.6130644679069519,0.10652073100209236,0.22990149183897302
5f5452df72345118f58d187b,0,a,30,blue_specific,priest with book facing left,0.7241433262825012,0.20769280195236206,0.21912921592593193,0.09425773099064827
5f5452df72345118f58d187b,0,a,32,red_specific,person kneeling facing right,0.22232504189014435,0.7170445919036865,0.10014288069214672,0.27152137889061123
5f5452df72345118f58d187b,0,a,33,blue_specific,priest,0.9999999403953552,0.20860205590724945,0.30216926243156195,0.12242382287513465
5f5452df72345118f58d187b,0,a,37,red_specific,diamond resting on flat surface,0.13307546079158783,0.32253238558769226,0.07449744222685695,0.12033344991505146
5f5452df72345118f58d187b,0,a,39,blue_specific,thriller guy walking with diamond backpack,0.34541308879852295,0.16734710335731506,0.12649680068716407,0.06517664878629148
5f5452df72345118f58d187b,0,a,41,blue_specific,flying angel,0.2519978880882263,0.31671881675720215,0.16530304914340377,0.13125014305114746
5f5452df72345118f58d187b,0,a,49,blue_specific,thriller,1.0,0.13752585649490356,0.27179842768236995,0.0480200236197561
5b735a4c3503c60001a891b7,2,a,3,blue_specific,Simplest one. Diamond head and bulky body like a flipped J.,0.3153017461299896,0.3397560715675354,0.12870374601334333,0.20072145760059357
5b735a4c3503c60001a891b7,2,a,14,blue_specific,"Diamond head, triangle body. Sitting down, two triangles for hats.",0.45241260528564453,0.4623536765575409,0.16516896313987672,0.20031848084181547
5b735a4c3503c60001a891b7,2,a,16,blue_specific,"Slightly hooked shaped body, diamond head, no arms or legs.",0.3277769088745117,0.37294697761535645,0.16356132086366415,0.2303281333297491
5b735a4c3503c60001a891b7,2,a,18,blue_specific,Guy with funny triangles as hat.,0.6512571573257446,0.3782934546470642,0.2031117109581828,0.1575666880235076
5b735a4c3503c60001a891b7,2,a,27,blue_specific,"Hooked shaped body, like a flipped J. Diamond head, no arms no legs.",0.3426043391227722,0.42311251163482666,0.17373681673780084,0.23153155390173197
5b735a4c3503c60001a891b7,2,a,35,blue_specific,Funny hat guy sitting down with triangle body,0.6595642566680908,0.3514462113380432,0.20703245140612125,0.14756036968901753
5b735a4c3503c60001a891b7,2,a,37,blue_specific,Funny hat guy with trianlge body.,0.7407404780387878,0.3670998215675354,0.22499546990729868,0.14600137621164322
5b735a4c3503c60001a891b7,2,a,41,blue_specific,Funny hat guy with triangle body,0.7477285861968994,0.3900383412837982,0.22723006969317794,0.1705034850165248
5b735a4c3503c60001a891b7,2,a,45,blue_specific,Funny hat guy with a triangle body. Sitting down.,0.6727687120437622,0.3534735441207886,0.209543923381716,0.1480077300220728
5b735a4c3503c60001a891b7,2,a,49,blue_specific,Funny hat looking guy. Triangle body,0.7305024862289429,0.39067012071609497,0.23495246144011617,0.18807705119252205
67ace9b8a3dada8f64274fd7,2,b,6,blue_specific,squatting guy facing righ. for him his back is straight,0.6562896370887756,0.14609003067016602,0.198175304569304,0.05821606237441301
67ace9b8a3dada8f64274fd7,2,b,11,blue_specific,cube man with diamond head,0.5022128820419312,0.3990021347999573,0.17023441195487976,0.12470174161717296
67ace9b8a3dada8f64274fd7,2,b,15,red_specific,big two triangle ears on a head  sitting on the ground,0.4274998903274536,0.2943904399871826,0.20513245090842247,0.17091583460569382
67ace9b8a3dada8f64274fd7,2,b,16,blue_specific,squatting with pointed back and hands facing right,0.7886160612106323,0.18602105975151062,0.26844789169263095,0.07713706989306957
67ace9b8a3dada8f64274fd7,2,b,22,red_specific,sad guy,0.23213055729866028,0.7999447584152222,0.06197415990754962,0.23599212523549795
67ace9b8a3dada8f64274fd7,2,b,25,red_specific,sad guy,0.23213055729866028,0.7999447584152222,0.06197415990754962,0.23599212523549795
67ace9b8a3dada8f64274fd7,2,b,28,blue_specific,squats,1.0,0.10511928796768188,0.2601094632409513,0.05869243899360299
67ace9b8a3dada8f64274fd7,2,b,29,red_specific,sad guy,0.23213055729866028,0.7999447584152222,0.06197415990754962,0.23599212523549795
67ace9b8a3dada8f64274fd7,2,b,33,red_specific,flying bird,0.5160132646560669,0.20335032045841217,0.1540688828099519,0.1362313525751233
67ace9b8a3dada8f64274fd7,2,b,35,blue_specific,squatting guy with pointed back,0.6815111637115479,0.16890579462051392,0.19883023109287024,0.04136268375441432
67ace9b8a3dada8f64274fd7,2,b,42,blue_specific,squats with pointed back,0.8641712665557861,0.13755589723587036,0.2652257918380201,0.05928388936445117
67ace9b8a3dada8f64274fd7,2,b,43,blue_specific,squat with flat back,0.8659076690673828,0.10734258592128754,0.26514872116968036,0.044964706408791244
67ace9b8a3dada8f64274fd7,2,b,44,red_specific,flying bird,0.5160132646560669,0.20335032045841217,0.1540688828099519,0.1362313525751233
67ace9b8a3dada8f64274fd7,2,b,46,red_specific,horse,0.3521376848220825,1.0,0.1421683580847457,0.27472345903515816
67ace9b8a3dada8f64274fd7,2,b,50,red_specific,sad guy,0.23213055729866028,0.7999447584152222,0.06197415990754962,0.23599212523549795
67ace9b8a3dada8f64274fd7,2,b,52,blue_specific,cube man,0.6578354835510254,0.24521538615226746,0.19009061576798558,0.10999930219259113
66ad6f2765f2ef7122225388,0,a,0,blue_specific,hunchback,0.27697306871414185,0.31009793281555176,0.16168421716429293,0.14948657993227243
66ad6f2765f2ef7122225388,0,a,3,blue_specific,graduate receiving diploma,0.13201594352722168,0.08857455849647522,-0.011929020518437028,0.014433056814596057
66ad6f2765f2ef7122225388,0,a,9,red_specific,magician,0.3687160015106201,0.22223511338233948,0.2443309989757836,0.11669885367155075
66ad6f2765f2ef7122225388,0,a,12,blue_specific,thriller,1.0,0.13752585649490356,0.27179842768236995,0.0480200236197561
66ad6f2765f2ef7122225388,0,a,14,blue_specific,celebrate graduation,0.1898363083600998,0.13320304453372955,0.014749899157322943,0.011457027867436409
66ad6f2765f2ef7122225388,0,a,15,blue_specific,standing priest facing left,0.7496252655982971,0.29568856954574585,0.1676780164707452,0.12189097888767719
66ad6f2765f2ef7122225388,0,a,21,red_specific,minnesota with a diamond on top,0.2755735516548157,0.24519440531730652,0.1011232491582632,0.12249323772266507
66ad6f2765f2ef7122225388,0,a,26,blue_specific,flying nun,0.46466371417045593,0.4254043996334076,0.19524582294980064,0.12466685357503593
66ad6f2765f2ef7122225388,0,a,27,blue_specific,lecturer,0.33923715353012085,0.2875041961669922,0.17141917091794312,0.1570191108621657
66ad6f2765f2ef7122225388,0,a,34,red_specific,duck balancing diamond on head,0.34750330448150635,0.6346861720085144,0.17314034211449325,0.1825098772533238
66ad6f2765f2ef7122225388,0,a,36,blue_specific,sad guy with two heads,0.5893516540527344,0.3035440146923065,0.21605088049545884,0.08681543997954577
66ad6f2765f2ef7122225388,0,a,37,blue_specific,cheerful graduate,0.24805296957492828,0.18653693795204163,0.13401024648919702,0.11660491861402988
66ad6f2765f2ef7122225388,0,a,38,blue_specific,professor handing out diploma,0.34605538845062256,0.17040295898914337,0.06398094724863768,0.0595126289408654
66ad6f2765f2ef7122225388,0,a,44,red_specific,montana,0.14935898780822754,0.1799374222755432,0.052087647025473416,0.07011294667609036
66ad6f2765f2ef7122225388,0,a,45,red_specific,quack,0.38573795557022095,0.32337427139282227,0.2326672561466694,0.1423423383384943
66ad6f2765f2ef7122225388,0,a,46,red_specific,crouching monk,0.5756571292877197,0.5692330598831177,0.21455952618271112,0.2636618372052908
66ad6f2765f2ef7122225388,0,a,49,blue_specific,falling graduate,0.2580872178077698,0.3162592947483063,0.08217390219215304,0.11946211336180568
65298aca34ac384b783169d4,2,a,5,red_specific,person facing left with one foot sticking out to right while bent over. arms outstretched to left.,0.18751314282417297,0.46079692244529724,0.10353866964578629,0.23033492371905595
65298aca34ac384b783169d4,2,a,6,blue_specific,person sitting down facing right with bunny ears,0.3784841001033783,0.27954787015914917,0.15229232632555068,0.1507727261632681
65298aca34ac384b783169d4,2,a,9,red_specific,person facing right kneeling with book,0.20462217926979065,0.46732020378112793,0.12339287321083248,0.2139372667297721
65298aca34ac384b783169d4,2,a,11,red_specific,person with no limbs and disfigured body cuts on right side of body only,0.24431031942367554,0.3442128300666809,0.10336767113767564,0.18350148934405297
65298aca34ac384b783169d4,2,a,15,blue_specific,bunny ear human,0.3629246950149536,0.37665754556655884,0.16338318726047873,0.14457120606675744
65298aca34ac384b783169d4,2,a,16,red_specific,priest on knees facing right,0.6803762912750244,0.36060696840286255,0.17758488818071783,0.15186741203069687
65298aca34ac384b783169d4,2,a,18,blue_specific,limbs hidden while sitting down,0.2201594114303589,0.46892091631889343,0.10635827458463609,0.21136643481440842
65298aca34ac384b783169d4,2,a,26,blue_specific,flying person,0.34216874837875366,0.3797273635864258,0.1378950288053602,0.1488187436480075
65298aca34ac384b783169d4,2,a,28,red_specific,priest facing right on knees,0.6981691122055054,0.335894912481308,0.17653330997563899,0.14413266617339104
65298aca34ac384b783169d4,2,a,33,blue_specific,bunny ears,0.3235185146331787,0.4124242961406708,0.16959754191339016,0.15309148747473955
65298aca34ac384b783169d4,2,a,34,blue_specific,no arms only head body and lower body,0.327968955039978,0.37817516922950745,0.16362208547070622,0.19952092226594687
65298aca34ac384b783169d4,2,a,35,red_specific,"no limbs, body torn on right side",0.2974063754081726,0.39767318964004517,0.15270318277180195,0.2018782515078783
65298aca34ac384b783169d4,2,a,39,red_specific,kneeling priest facing right,0.6810038089752197,0.42835837602615356,0.18931673001497984,0.1724840234965086
65298aca34ac384b783169d4,2,a,41,blue_specific,no arms but sitting down,0.3405543565750122,0.3849342167377472,0.15604604361578822,0.18768055690452456
65298aca34ac384b783169d4,2,a,44,blue_specific,woman dancing with fans,0.13934677839279175,0.5505968332290649,0.06616631522774696,0.09568284399574623
644455d33169a831ae5f2ed7,2,a,6,blue_specific,"Its another sitting down one, but not bunny or rabbit, instead its a Diamond head, and the ears are now hands to the right and triangle. They are sitting down, very awkwardly.",0.24698156118392944,0.385424941778183,0.1618397505953908,0.1997080883011222
644455d33169a831ae5f2ed7,2,a,7,blue_specific,"Has a diamond shaped head, not an animal, no ears, its slightly kneeling showing knees to the right. Its the most simplest one.",0.22778108716011047,0.4213053584098816,0.15130849089473486,0.2308041537180543
644455d33169a831ae5f2ed7,2,a,18,red_specific,"Kinda looks like if you take the mouse one and reposition it to face more forward with head to the right, it has two diamonds sitting on top of each other and is the only one with two diamonds of the same size.",0.4658014476299286,0.2528172433376312,0.13398732733912766,0.1354471598751843
644455d33169a831ae5f2ed7,2,a,20,blue_specific,"Looks like a bunny rabbit, with two upside down triangles on its square head, kneeling down. Body is a triangle.",0.29294776916503906,0.34171032905578613,0.15361024253070354,0.22787689743563533
644455d33169a831ae5f2ed7,2,a,23,red_specific,"Not an animal, similar to the priest, diamond head, kneeling to the right, with pointy hands facing right.",0.5713826417922974,0.37259069085121155,0.2398659992031753,0.20884485309943557
644455d33169a831ae5f2ed7,2,a,24,red_specific,Kinda looks like Godzilla is figure skating with one leg outward to the right.,0.20773407816886902,0.31626564264297485,0.09985520876944065,0.19988387159537524
644455d33169a831ae5f2ed7,2,a,25,blue_specific,"Similar to the priest, has a diamond head but no arms outwards, simplest one, just keeling forward.",0.5262649059295654,0.34795838594436646,0.25536245573312044,0.21477842517197132
644455d33169a831ae5f2ed7,2,a,28,blue_specific,"It's the bunny rabbit, with the upside down triangles on a square head and triangle body facing to the right.",0.34748148918151855,0.3599894642829895,0.1500342779327184,0.20929234195500612
644455d33169a831ae5f2ed7,2,a,29,red_specific,"Not like an animal, more like the priest, but no hands or legs visible. Diamond head. Square like body that looks like a chunk is missing.",0.3871508836746216,0.2969943881034851,0.24917281977832317,0.20072756707668304
